
> ai-recruiter2@0.1.0 test
> jest --coverage --passWithNoTests

node.exe : PASS __tests__/Fo
rmContainer.test.jsx (7.576 
s)
At C:\Users\user\AppData\Roa
ming\npm\npm.ps1:24 char:5
+     & "node$exe"  "$basedi
r/node_modules/npm/bin/npm-c
li.js" $args
+     ~~~~~~~~~~~~~~~~~~~~~~
~~~~~~~~~~~~~~~~~~~~~~~~~~~~
~~~~~~~~~~~~
    + CategoryInfo          
    : NotSpecified: (PASS   
  __tests__/...t.jsx (7.5   
 76 s):String) [], Remot    
eException
    + FullyQualifiedErrorId 
    : NativeCommandError
 
PASS __tests__/CreateOptions
.test.jsx (7.401 s)
PASS __tests__/WelcomeContai
ner.test.jsx (7.144 s)
FAIL __tests__/CandidateFeed
backDialog.test.jsx (7.548 
s)
  ● 
CandidateFeedbackDialog 
Component › renders 
feedback details correctly

    
TestingLibraryElementError: 
Found multiple elements 
with the text: 8/10

    Here are the matching 
elements:

    Ignored nodes: 
comments, script, style
    [36m<h2[39m
      [33mclass[39m=[32m"
text-primary text-2xl 
font-bold"[39m
    [36m>[39m
      [0m8[0m
      [0m/10[0m
    [36m</h2>[39m

    Ignored nodes: 
comments, script, style
    [36m<span>[39m
      [0m8[0m
      [0m/10[0m
    [36m</span>[39m

    Ignored nodes: 
comments, script, style
    [36m<span>[39m
      [0m8[0m
      [0m/10[0m
    [36m</span>[39m

    (If this is 
intentional, then use the 
`*AllBy*` variant of the 
query (like 
`queryAllByText`, 
`getAllByText`, or 
`findAllByText`)).

    Ignored nodes: 
comments, script, style
    [36m<body>[39m
      [36m<div>[39m
        [36m<div[39m
          [33mdata-testid[
39m=[32m"dialog"[39m
        [36m>[39m
          [36m<div[39m
            [33mdata-testid
[39m=[32m"dialog-trigger"
[39m
          [36m>[39m
            
[36m<button[39m
              [33mclass[39
m=[32m"inline-flex 
items-center justify-center 
cursor-pointer gap-2 
whitespace-nowrap 
rounded-md text-sm 
font-medium transition-all d
isabled:pointer-events-none 
disabled:opacity-50 
[&_svg]:pointer-events-none 
[&_svg:not([class*='size-'])
]:size-4 shrink-0 
[&_svg]:shrink-0 
outline-none 
focus-visible:border-ring 
focus-visible:ring-ring/50 
focus-visible:ring-[3px] ari
a-invalid:ring-destructive/2
0 dark:aria-invalid:ring-des
tructive/40 aria-invalid:bor
der-destructive border 
bg-background shadow-xs 
hover:bg-accent hover:text-a
ccent-foreground 
dark:bg-input/30 
dark:border-input 
dark:hover:bg-input/50 h-9 
px-4 py-2 has-[>svg]:px-3 
text-primary"[39m
              [33mdata-slot
[39m=[32m"button"[39m
            [36m>[39m
              [0mView 
Report[0m
            
[36m</button>[39m
          [36m</div>[39m
          [36m<div[39m
            [33mdata-testid
[39m=[32m"dialog-content"
[39m
          [36m>[39m
            [36m<div[39m
              [33mdata-test
id[39m=[32m"dialog-header"
[39m
            [36m>[39m
              [36m<div[39m
                [33mdata-te
stid[39m=[32m"dialog-title
"[39m
              [36m>[39m
                
[0mFeedback[0m
              
[36m</div>[39m
              [36m<div[39m
                [33mdata-te
stid[39m=[32m"dialog-descr
iption"[39m
              [36m>[39m
                
[36m<div[39m
                  [33mclass
[39m=[32m"mt-5"[39m
                [36m>[39m
                  
[36m<div[39m
                    
[33mclass[39m=[32m"flex 
justify-between 
items-center"[39m
                  
[36m>[39m
                    
[36m<div[39m
                      
[33mclass[39m=[32m"flex 
items-center gap-5"[39m
                    
[36m>[39m
                      
[36m<h2[39m
                        [33
mclass[39m=[32m"bg-primary
 p-3 px-4.5 font-bold 
text-white 
rounded-full"[39m
                      
[36m>[39m
                        
[0mJ[0m
                      
[36m</h2>[39m
                      
[36m<div>[39m
                        
[36m<h2[39m
                          [
33mclass[39m=[32m"font-bol
d"[39m
                        
[36m>[39m
                          
[0mJohn Doe[0m
                        
[36m</h2>[39m
                        
[36m<h2[39m
                          [
33mclass[39m=[32m"text-sm 
text-gray-500"[39m
                        
[36m>[39m
                          
[0mjohn@example.com[0m
                        
[36m</h2>[39m
                      
[36m</div>[39m
                    
[36m</div>[39m
                    
[36m<div[39m
                      
[33mclass[39m=[32m"flex 
gap-3 items-center"[39m
                    
[36m>[39m
                      
[36m<h2[39m
                        [33
mclass[39m=[32m"text-prima
ry text-2xl font-bold"[39m
                      
[36m>[39m
                        
[0m8[0m
                        
[0m/10[0m
                      
[36m</h2>[39m
                    
[36m</div>[39m
                  
[36m</div>[39m
                  
[36m<div[39m
                    [33mcla
ss[39m=[32m"mt-5"[39m
                  
[36m>[39m
                    
[36m<h2[39m
                      [33mc
lass[39m=[32m"font-bold"[
39m
                    
[36m>[39m
                      
[0mSkill Assessment[0m
                    
[36m</h2>[39m
                    
[36m<div[39m
                      
[33mclass[39m=[32m"mt-5 
space-y-4"[39m
                    
[36m>[39m
                      
[36m<div>[39m
                        
[36m<h2[39m
                          
[33mclass[39m=[32m"flex 
justify-between"[39m
                        
[36m>[39m
                          
[0mTechnical Skills[0m
                          
[36m<span>[39m
                            
[0m9[0m
                            
[0m/10[0m
                          
[36m</span>[39m
                        
[36m</h2>[39m
                        
[36m<div[39m
                          [
33mdata-testid[39m=[32m"pr
ogress-bar"[39m
                          [
33mdata-value[39m=[32m"90"
[39m
                        
[36m/>[39m
                      
[36m</div>[39m
                      
[36m<div>[39m
                        
[36m<h2[39m
                          
[33mclass[39m=[32m"flex 
justify-between"[39m
                        
[36m>[39m
                          
[0mCommunication[0m
                          
[36m<span>[39m
                            
[0m7[0m
                            
[0m/10[0m
                          
[36m</span>[39m
                        
[36m</h2>[39m
                        
[36m<div[39m
                          [
33mdata-testid[39m=[32m"pr
ogress-bar"[39m
                          [
33mdata-value[39m=[32m"70"
[39m
                        
[36m/>[39m
                      
[36m</div>[39m
                      
[36m<div>[39m
                        
[36m<h2[39m
                          
[33mclass[39m=[32m"flex 
justify-between"[39m
                        
[36m>[39m
                          
[0mProblem Solving[0m
                          
[36m<span>[39m
                            
[0m8[0m
                            
[0m/10[0m
                          
[36m</span>[39m
                        
[36m</h2>[39m
                        
[36m<div[39m
                          [
33mdata-testid[39m=[32m"pr
ogress-bar"[39m
                          [
33mdata-value[39m=[32m"80"
[39m
                        
[36m/>[39m
                      
[36m</div>[39m
                      
[36m<div>[39m
                        
[36m<h2[39m
                          
[33mclass[39m=[32m"flex 
justify-between"[39m
                        
[36m>[39m
                          
[0mExperience[0m
                          
[36m<span>[39m
                            
[0m8[0m
                            
[0m/10[0m
                          
[36m</span>[39m
                        
[36m</h2>[39m
                        
[36m<div[39m
                          [
33mdata-testid[39m=[32m"pr
ogress-bar"[39m
                          [
33mdata-value[39m=[32m"80"
[39m
                        
[36m/>[39m
                      
[36m</div>[39m
                    
[36m</div>[39m
                  
[36m</div>[39m
                  
[36m<div[39m
                    [33mcla
ss[39m=[32m"mt-5"[39m
                  
[36m>[39m
                    
[36m<h2[39m
                      [33mc
lass[39m=[32m"font-bold"[
39m
                    
[36m>[39m
                      
[0mPerformance Summary[0m
                    
[36m</h2>[39m
                    
[36m<div[39m
                      
[33mclass[39m=[32m"p-5 
bg-secondary my-3 
rounded-md space-y-2"[39m
                    
[36m>[39m
                      
[36m<p>[39m
                        
[0mStrong candidate[0m
                      
[36m</p>[39m
                      
[36m<p>[39m
                        
[0mGood communication[0m
                      
[36m</p>[39m
                    
[36m</div>[39m
                  
[36m</div>[39m
                  
[36m<div[39m
                    
[33mclass[39m=[32m"p-5 
mt-10 flex items-center 
justify-between rounded-md 
bg-green-100"[39m
                  
[36m>[39m
                    
[36m<div>[39m
                      
[36m<h2[39m
                        [33
mclass[39m=[32m"font-bold 
text-green-700"[39m
                      
[36m>[39m
                        
[0mRecommendation[0m
                      
[36m</h2>[39m
                      
[36m<p[39m
                        
[33mclass[39m=[32m"mt-1 
text-green-500"[39m
                      
[36m>[39m
                        
[0mHighly recommended for 
the role.[0m
                      
[36m</p>[39m
                    
[36m</div>[39m
                    
[36m<button[39m
                      [33mc
lass[39m=[32m"inline-flex 
items-center justify-center 
cursor-pointer gap-2 
whitespace-nowrap 
rounded-md text-sm 
font-medium transition-all d
isabled:pointer-events-none 
disabled:opacity-50 
[&_svg]:pointer-events-none 
[&_svg:not([class*='size-'])
]:size-4 shrink-0 
[&_svg]:shrink-0 
outline-none 
focus-visible:border-ring 
focus-visible:ring-ring/50 
focus-visible:ring-[3px] ari
a-invalid:ring-destructive/2
0 dark:aria-invalid:ring-des
tructive/40 aria-invalid:bor
der-destructive 
text-primary-foreground 
hover:bg-primary/90 h-9 
px-4 py-2 has-[>svg]:px-3 
bg-green-700"[39m
                      [33md
ata-slot[39m=[32m"button"
[39m
                    
[36m>[39m
                      
[0mSend Msg[0m
                    
[36m</button>[39m
                  
[36m</div>[39m
                
[36m</div>[39m
              
[36m</div>[39m
            [36m</div>[39m
          [36m</div>[39m
        [36m</div>[39m
      [36m</div>[39m
    [36m</body>[39m

    [0m [90m 53 |[39m    
 expect(screen[33m.[39mget
ByText([32m"John Doe"[39m)
)[33m.[39mtoBeInTheDocumen
t()[33m;[39m
     [90m 54 |[39m     exp
ect(screen[33m.[39mgetByTe
xt([32m"john@example.com"[
39m))[33m.[39mtoBeInTheDoc
ument()[33m;[39m
    
[31m[1m>[22m[39m[90m 
55 |[39m     expect(screen
[33m.[39mgetByText([32m"8/
10"[39m))[33m.[39mtoBeInT
heDocument()[33m;[39m
     [90m    |[39m        
           
[31m[1m^[22m[39m
     [90m 56 |[39m     exp
ect(screen[33m.[39mgetByTe
xt([32m"Technical Skills"[
39m))[33m.[39mtoBeInTheDoc
ument()[33m;[39m
     [90m 57 |[39m     exp
ect(screen[33m.[39mgetByTe
xt([32m"9/10"[39m))[33m.
[39mtoBeInTheDocument()[33m
;[39m
     [90m 58 |[39m     exp
ect(screen[33m.[39mgetByTe
xt([32m"Strong candidate"[
39m))[33m.[39mtoBeInTheDoc
ument()[33m;[39m[0m

      at 
Object.getElementError (node
_modules/@testing-library/do
m/dist/config.js:37:19)
      at getElementError (no
de_modules/@testing-library/
dom/dist/query-helpers.js:20
:35)
      at getMultipleElements
FoundError (node_modules/@te
sting-library/dom/dist/query
-helpers.js:23:10)
      at node_modules/@testi
ng-library/dom/dist/query-he
lpers.js:55:13
      at node_modules/@testi
ng-library/dom/dist/query-he
lpers.js:95:19
      at Object.getByText (_
_tests__/CandidateFeedbackDi
alog.test.jsx:55:19)

PASS __tests__/ai-model-rout
e.test.jsx (7.074 s)
  ● Console

    console.log
      Prompt sent:
       
      You are an expert 
technical interviewer.
      Based on the 
following inputs, generate 
a well-structured list of 
high-quality interview 
questions:
      
      Job Title: Frontend 
Engineer
      Job Description: 
React expert
      Interview Duration: 
30 Min
      Interview Type: 
technical
      
      Your task:
      Analyze the job 
description to identify key 
responsibilities, required 
skills, and expected 
experience.
      Generate a list of 
interview questions 
depending on the interview 
duration.
      Adjust the number and 
depth of questions to match 
the interview duration.
      Ensure the questions 
match the tone and 
structure of a real-life 
{{type}} interview.
      
      Format your response 
in JSON format with an 
array list of questions:
      Format:
      interviewQuestions = [
        {
          question: "",
          type: "Technical/B
ehavioral/Experience/Problem
 Solving/Leadership"
        },
        {
          ...
        }
      ]
      
      The goal is to create 
a structured, relevant, and 
time-optimized interview 
plan for a {{jobTitle}} 
role.

      at log (app/api/ai-mod
el/route.jsx:62:13)

    console.log
      Trying: 
openai/gpt-oss-20b:free

      at log (app/api/ai-mod
el/route.jsx:81:17)

    console.log
      SUCCESS: 
openai/gpt-oss-20b:free

      at log (app/api/ai-mod
el/route.jsx:98:17)

    console.log
      RAW OUTPUT: ```json{"i
nterviewQuestions":["Q1","Q2
"]}```

      at log (app/api/ai-mod
el/route.jsx:118:13)

    console.log
      Prompt sent:
       
      You are an expert 
technical interviewer.
      Based on the 
following inputs, generate 
a well-structured list of 
high-quality interview 
questions:
      
      Job Title: QA Engineer
      Job Description: 
Testing APIs
      Interview Duration: 
15 Min
      Interview Type: 
behavioral
      
      Your task:
      Analyze the job 
description to identify key 
responsibilities, required 
skills, and expected 
experience.
      Generate a list of 
interview questions 
depending on the interview 
duration.
      Adjust the number and 
depth of questions to match 
the interview duration.
      Ensure the questions 
match the tone and 
structure of a real-life 
{{type}} interview.
      
      Format your response 
in JSON format with an 
array list of questions:
      Format:
      interviewQuestions = [
        {
          question: "",
          type: "Technical/B
ehavioral/Experience/Problem
 Solving/Leadership"
        },
        {
          ...
        }
      ]
      
      The goal is to create 
a structured, relevant, and 
time-optimized interview 
plan for a {{jobTitle}} 
role.
      
      
      Focus on real-world 
scenarios, past 
experiences, and 
decision-making.

      at log (app/api/ai-mod
el/route.jsx:62:13)

    console.log
      Trying: 
openai/gpt-oss-20b:free

      at log (app/api/ai-mod
el/route.jsx:81:17)

    console.log
      FAILED: 
openai/gpt-oss-20b:free 
Model 1 failed

      at log (app/api/ai-mod
el/route.jsx:102:17)

    console.log
      Trying: nvidia/nemotro
n-nano-9b-v2:free

      at log (app/api/ai-mod
el/route.jsx:81:17)

    console.log
      SUCCESS: nvidia/nemotr
on-nano-9b-v2:free

      at log (app/api/ai-mod
el/route.jsx:98:17)

    console.log
      RAW OUTPUT: ```json{"i
nterviewQuestions":["Q1","Q2
"]}```

      at log (app/api/ai-mod
el/route.jsx:118:13)

    console.log
      Prompt sent:
       
      You are an expert 
technical interviewer.
      Based on the 
following inputs, generate 
a well-structured list of 
high-quality interview 
questions:
      
      Job Title: Designer
      Job Description: 
UI/UX design
      Interview Duration: 
15 Min
      Interview Type: 
creative
      
      Your task:
      Analyze the job 
description to identify key 
responsibilities, required 
skills, and expected 
experience.
      Generate a list of 
interview questions 
depending on the interview 
duration.
      Adjust the number and 
depth of questions to match 
the interview duration.
      Ensure the questions 
match the tone and 
structure of a real-life 
{{type}} interview.
      
      Format your response 
in JSON format with an 
array list of questions:
      Format:
      interviewQuestions = [
        {
          question: "",
          type: "Technical/B
ehavioral/Experience/Problem
 Solving/Leadership"
        },
        {
          ...
        }
      ]
      
      The goal is to create 
a structured, relevant, and 
time-optimized interview 
plan for a {{jobTitle}} 
role.

      at log (app/api/ai-mod
el/route.jsx:62:13)

    console.log
      Trying: 
openai/gpt-oss-20b:free

      at log (app/api/ai-mod
el/route.jsx:81:17)

    console.log
      FAILED: 
openai/gpt-oss-20b:free All 
models failed

      at log (app/api/ai-mod
el/route.jsx:102:17)

    console.log
      Trying: nvidia/nemotro
n-nano-9b-v2:free

      at log (app/api/ai-mod
el/route.jsx:81:17)

    console.log
      FAILED: nvidia/nemotro
n-nano-9b-v2:free All 
models failed

      at log (app/api/ai-mod
el/route.jsx:102:17)

    console.log
      Trying: kwaipilot/kat-
coder-pro-v1:free

      at log (app/api/ai-mod
el/route.jsx:81:17)

    console.log
      FAILED: kwaipilot/kat-
coder-pro-v1:free All 
models failed

      at log (app/api/ai-mod
el/route.jsx:102:17)

    console.log
      Trying: nvidia/nemotro
n-nano-12b-vl:free

      at log (app/api/ai-mod
el/route.jsx:81:17)

    console.log
      FAILED: nvidia/nemotro
n-nano-12b-vl:free All 
models failed

      at log (app/api/ai-mod
el/route.jsx:102:17)

    console.log
      Trying: 
x-ai/grok-4.1-fast:free

      at log (app/api/ai-mod
el/route.jsx:81:17)

    console.log
      FAILED: 
x-ai/grok-4.1-fast:free All 
models failed

      at log (app/api/ai-mod
el/route.jsx:102:17)

    console.log
      Prompt sent:
       
      You are an expert 
technical interviewer.
      Based on the 
following inputs, generate 
a well-structured list of 
high-quality interview 
questions:
      
      Job Title: DevOps 
Engineer
      Job Description: 
Cloud and CI/CD
      Interview Duration: 
60 Min
      Interview Type: 
technical
      
      Your task:
      Analyze the job 
description to identify key 
responsibilities, required 
skills, and expected 
experience.
      Generate a list of 
interview questions 
depending on the interview 
duration.
      Adjust the number and 
depth of questions to match 
the interview duration.
      Ensure the questions 
match the tone and 
structure of a real-life 
{{type}} interview.
      
      Format your response 
in JSON format with an 
array list of questions:
      Format:
      interviewQuestions = [
        {
          question: "",
          type: "Technical/B
ehavioral/Experience/Problem
 Solving/Leadership"
        },
        {
          ...
        }
      ]
      
      The goal is to create 
a structured, relevant, and 
time-optimized interview 
plan for a {{jobTitle}} 
role.

      at log (app/api/ai-mod
el/route.jsx:62:13)

    console.log
      Trying: 
openai/gpt-oss-20b:free

      at log (app/api/ai-mod
el/route.jsx:81:17)

    console.log
      SUCCESS: 
openai/gpt-oss-20b:free

      at log (app/api/ai-mod
el/route.jsx:98:17)

    console.log
      RAW OUTPUT: ```json{"i
nterviewQuestions":["Q1","Q2
"]}```

      at log (app/api/ai-mod
el/route.jsx:118:13)

    console.log
      Prompt sent:
       
      You are an expert 
technical interviewer.
      Based on the 
following inputs, generate 
a well-structured list of 
high-quality interview 
questions:
      
      Job Title: Retry Role
      Job Description: 
Retry scenario
      Interview Duration: 
15 Min
      Interview Type: 
technical
      
      Your task:
      Analyze the job 
description to identify key 
responsibilities, required 
skills, and expected 
experience.
      Generate a list of 
interview questions 
depending on the interview 
duration.
      Adjust the number and 
depth of questions to match 
the interview duration.
      Ensure the questions 
match the tone and 
structure of a real-life 
{{type}} interview.
      
      Format your response 
in JSON format with an 
array list of questions:
      Format:
      interviewQuestions = [
        {
          question: "",
          type: "Technical/B
ehavioral/Experience/Problem
 Solving/Leadership"
        },
        {
          ...
        }
      ]
      
      The goal is to create 
a structured, relevant, and 
time-optimized interview 
plan for a {{jobTitle}} 
role.

      at log (app/api/ai-mod
el/route.jsx:62:13)

    console.log
      Trying: 
openai/gpt-oss-20b:free

      at log (app/api/ai-mod
el/route.jsx:81:17)

    console.log
      FAILED: 
openai/gpt-oss-20b:free 
Rate limit

      at log (app/api/ai-mod
el/route.jsx:102:17)

    console.log
      Trying: nvidia/nemotro
n-nano-9b-v2:free

      at log (app/api/ai-mod
el/route.jsx:81:17)

    console.log
      SUCCESS: nvidia/nemotr
on-nano-9b-v2:free

      at log (app/api/ai-mod
el/route.jsx:98:17)

    console.log
      RAW OUTPUT: ```json{"i
nterviewQuestions":["Q1","Q2
"]}```

      at log (app/api/ai-mod
el/route.jsx:118:13)

    console.log
      Prompt sent:
       
      You are an expert 
technical interviewer.
      Based on the 
following inputs, generate 
a well-structured list of 
high-quality interview 
questions:
      
      Job Title: NoJson Role
      Job Description: No 
JSON here
      Interview Duration: 5 
Min
      Interview Type: 
technical
      
      Your task:
      Analyze the job 
description to identify key 
responsibilities, required 
skills, and expected 
experience.
      Generate a list of 
interview questions 
depending on the interview 
duration.
      Adjust the number and 
depth of questions to match 
the interview duration.
      Ensure the questions 
match the tone and 
structure of a real-life 
{{type}} interview.
      
      Format your response 
in JSON format with an 
array list of questions:
      Format:
      interviewQuestions = [
        {
          question: "",
          type: "Technical/B
ehavioral/Experience/Problem
 Solving/Leadership"
        },
        {
          ...
        }
      ]
      
      The goal is to create 
a structured, relevant, and 
time-optimized interview 
plan for a {{jobTitle}} 
role.

      at log (app/api/ai-mod
el/route.jsx:62:13)

    console.log
      Trying: 
openai/gpt-oss-20b:free

      at log (app/api/ai-mod
el/route.jsx:81:17)

    console.log
      SUCCESS: 
openai/gpt-oss-20b:free

      at log (app/api/ai-mod
el/route.jsx:98:17)

    console.log
      RAW OUTPUT: some 
plain text without json

      at log (app/api/ai-mod
el/route.jsx:118:13)

PASS __tests__/Dashboard.tes
t.jsx (7.327 s)
PASS __tests__/CreateIntervi
ew.test.jsx (8.112 s)
  ● Console

    console.log
      FormData updated: {}

      at log (E:\NextJS\ai-r
ecruiter2\app\(main)../../da
shboard/create-interview/pag
e.jsx:35:13)

    console.log
      ✅ User saved to DB

      at log 
(app/provider.jsx:39:22)

    console.log
      FormData updated: {}

      at log (E:\NextJS\ai-r
ecruiter2\app\(main)../../da
shboard/create-interview/pag
e.jsx:35:13)

    console.log
      ✅ User saved to DB

      at log 
(app/provider.jsx:39:22)

    console.log
      FormData updated: {}

      at log (E:\NextJS\ai-r
ecruiter2\app\(main)../../da
shboard/create-interview/pag
e.jsx:35:13)

    console.log
      Form data: {}

      at Object.log [as 
GoToNext] (E:\NextJS\ai-recr
uiter2\app\(main)../../dashb
oard/create-interview/page.j
sx:39:13)

    console.log
      ✅ User saved to DB

      at log 
(app/provider.jsx:39:22)

    console.log
      FormData updated: {}

      at log (E:\NextJS\ai-r
ecruiter2\app\(main)../../da
shboard/create-interview/pag
e.jsx:35:13)

    console.log
      FormData updated: {
        jobPosition: 'Dev',
        jobDescription: 
'Desc',
        duration: '30 Min',
        type: [ 'Video 
Interview' ]
      }

      at log (E:\NextJS\ai-r
ecruiter2\app\(main)../../da
shboard/create-interview/pag
e.jsx:35:13)

    console.log
      Form data: {
        jobPosition: 'Dev',
        jobDescription: 
'Desc',
        duration: '30 Min',
        type: [ 'Video 
Interview' ]
      }

      at Object.log [as 
GoToNext] (E:\NextJS\ai-recr
uiter2\app\(main)../../dashb
oard/create-interview/page.j
sx:39:13)

    console.log
      ✅ User saved to DB

      at log 
(app/provider.jsx:39:22)

    console.log
      AI API payload: { 
result: { 
interviewQuestions: [ 
[Object] ] } }

      at Object.log [as 
GoToNext] (E:\NextJS\ai-recr
uiter2\app\(main)../../dashb
oard/create-interview/page.j
sx:71:15)

    console.log
      FormData updated: {}

      at log (E:\NextJS\ai-r
ecruiter2\app\(main)../../da
shboard/create-interview/pag
e.jsx:35:13)

    console.log
      FormData updated: {
        jobPosition: 'Dev',
        jobDescription: 
'Desc',
        duration: '30 Min',
        type: [ 'Video 
Interview' ]
      }

      at log (E:\NextJS\ai-r
ecruiter2\app\(main)../../da
shboard/create-interview/pag
e.jsx:35:13)

    console.log
      Form data: {
        jobPosition: 'Dev',
        jobDescription: 
'Desc',
        duration: '30 Min',
        type: [ 'Video 
Interview' ]
      }

      at Object.log [as 
GoToNext] (E:\NextJS\ai-recr
uiter2\app\(main)../../dashb
oard/create-interview/page.j
sx:39:13)

    console.log
      ✅ User saved to DB

      at log 
(app/provider.jsx:39:22)

    console.log
      AI API payload: { 
result: { 
interviewQuestions: [ 
[Object] ] } }

      at Object.log [as 
GoToNext] (E:\NextJS\ai-recr
uiter2\app\(main)../../dashb
oard/create-interview/page.j
sx:71:15)

    console.log
      FormData updated: {}

      at log (E:\NextJS\ai-r
ecruiter2\app\(main)../../da
shboard/create-interview/pag
e.jsx:35:13)

    console.log
      ✅ User saved to DB

      at log 
(app/provider.jsx:39:22)

PASS __tests__/DashboardProv
ider.test.jsx (7.933 s)
PASS __tests__/InterviewCard
.test.jsx (8.806 s)
PASS __tests__/AlertConfirma
tion.test.jsx (8.75 s)
PASS __tests__/QuestionList.
test.jsx (8.715 s)
  ● Console

    console.error
      Error saving 
interview: { message: 'DB 
failure' }

    [0m [90m 84 |[39m    
   
[36mreturn[39m[33m;[39m
     [90m 85 |[39m     }
    
[31m[1m>[22m[39m[90m 
86 |[39m     originalError(
[33m...[39margs)[33m;[39
m
     [90m    |[39m     
[31m[1m^[22m[39m
     [90m 87 |[39m   
}[33m;[39m
     [90m 88 |[39m 
})[33m;[39m
     [90m 89 |[39m 
afterAll(() [33m=>[39m 
{[0m

      at 
console.originalError [as 
error] (jest.setup.js:86:5)
      at error (E:\NextJS\ai
-recruiter2\app\(main)../../
dashboard/create-interview/_
components/QuestionList.jsx:
58:15)

PASS __tests__/InterviewLink
.test.jsx (8.772 s)
PASS __tests__/LatestIntervi
ewsList.test.jsx (8.925 s)
PASS __tests__/DashboardLayo
ut.test.jsx (9.061 s)
PASS __tests__/InterviewDeta
ilPage.test.jsx (8.791 s)
  ● Console

    console.log
      Interview detail: [
        {
          jobPosition: 
'Backend Engineer',
          jobDescription: 
'APIs',
          duration: '30 
Min',
          type: [ 
'Technical' ],
          created_at: 
'2025-12-31T21:30:18.685Z',
          questionList: [ 
[Object] ],
          
'interview-feedback': []
        }
      ]

      at log (E:\NextJS\ai-r
ecruiter2\app\(main)../../sc
hedule-interview/[interview_
id]/details/page.jsx:35:15)

PASS __tests__/InterviewPage
.test.jsx (9.307 s)
PASS __tests__/AppSidebar.te
st.jsx (9.51 s)
  ● Console

    console.error
      Warning: Function 
components cannot be given 
refs. Attempts to access 
this ref will fail. Did you 
mean to use 
React.forwardRef()?
      
      Check the render 
method of `Slot.SlotClone`.
          at href (E:\NextJS
\ai-recruiter2\__tests__\App
Sidebar.test.jsx:15:33)
          at E:\NextJS\ai-re
cruiter2\node_modules\@radix
-ui\react-slot\src\slot.tsx:
102:11
          at E:\NextJS\ai-re
cruiter2\node_modules\@radix
-ui\react-slot\src\slot.tsx:
46:11
          at E:\NextJS\ai-re
cruiter2\node_modules\@radix
-ui\react-primitive\node_mod
ules\@radix-ui\react-slot\sr
c\slot.tsx:68:13
          at E:\NextJS\ai-re
cruiter2\node_modules\@radix
-ui\react-primitive\node_mod
ules\@radix-ui\react-slot\sr
c\slot.tsx:15:13
          at E:\NextJS\ai-re
cruiter2\node_modules\@radix
-ui\react-primitive\src\prim
itive.tsx:40:13
          at E:\NextJS\ai-re
cruiter2\node_modules\@radix
-ui\react-primitive\node_mod
ules\@radix-ui\react-slot\sr
c\slot.tsx:68:13
          at E:\NextJS\ai-re
cruiter2\node_modules\@radix
-ui\react-primitive\node_mod
ules\@radix-ui\react-slot\sr
c\slot.tsx:15:13
          at E:\NextJS\ai-re
cruiter2\node_modules\@radix
-ui\react-primitive\src\prim
itive.tsx:40:13
          at E:\NextJS\ai-re
cruiter2\node_modules\@radix
-ui\react-popper\src\popper.
tsx:75:13
          at E:\NextJS\ai-re
cruiter2\node_modules\@radix
-ui\react-tooltip\src\toolti
p.tsx:269:13
          at props (E:\NextJ
S\ai-recruiter2\components\u
i\tooltip.jsx:26:6)
          at Provider (E:\Ne
xtJS\ai-recruiter2\node_modu
les\@radix-ui\react-context\
src\create-context.tsx:59:15
)
          at Provider (E:\Ne
xtJS\ai-recruiter2\node_modu
les\@radix-ui\react-context\
src\create-context.tsx:59:15
)
          at Popper (E:\Next
JS\ai-recruiter2\node_module
s\@radix-ui\react-popper\src
\popper.tsx:50:11)
          at Tooltip (E:\Nex
tJS\ai-recruiter2\node_modul
es\@radix-ui\react-tooltip\s
rc\tooltip.tsx:154:5)
          at Provider (E:\Ne
xtJS\ai-recruiter2\node_modu
les\@radix-ui\react-context\
src\create-context.tsx:59:15
)
          at 
TooltipProvider (E:\NextJS\a
i-recruiter2\node_modules\@r
adix-ui\react-tooltip\src\to
oltip.tsx:68:5)
          at delayDuration (
E:\NextJS\ai-recruiter2\comp
onents\ui\tooltip.jsx:9:3)
          at props (E:\NextJ
S\ai-recruiter2\components\u
i\tooltip.jsx:16:6)
          at asChild (E:\Nex
tJS\ai-recruiter2\components
\ui\sidebar.jsx:477:3)
          at li
          at className (E:\N
extJS\ai-recruiter2\componen
ts\ui\sidebar.jsx:442:3)
          at ul
          at className (E:\N
extJS\ai-recruiter2\componen
ts\ui\sidebar.jsx:429:3)
          at div
          at className (E:\N
extJS\ai-recruiter2\componen
ts\ui\sidebar.jsx:416:3)
          at div
          at className (E:\N
extJS\ai-recruiter2\componen
ts\ui\sidebar.jsx:361:3)
          at div
          at className (E:\N
extJS\ai-recruiter2\componen
ts\ui\sidebar.jsx:345:3)
          at div
          at div
          at div
          at side (E:\NextJS
\ai-recruiter2\components\ui
\sidebar.jsx:133:3)
          at AppSidebar
          at div
          at Provider (E:\Ne
xtJS\ai-recruiter2\node_modu
les\@radix-ui\react-context\
src\create-context.tsx:59:15
)
          at 
TooltipProvider (E:\NextJS\a
i-recruiter2\node_modules\@r
adix-ui\react-tooltip\src\to
oltip.tsx:68:5)
          at delayDuration (
E:\NextJS\ai-recruiter2\comp
onents\ui\tooltip.jsx:9:3)
          at defaultOpen (E:
\NextJS\ai-recruiter2\compon
ents\ui\sidebar.jsx:46:3)

    [0m [90m 84 |[39m    
   
[36mreturn[39m[33m;[39m
     [90m 85 |[39m     }
    
[31m[1m>[22m[39m[90m 
86 |[39m     originalError(
[33m...[39margs)[33m;[39
m
     [90m    |[39m     
[31m[1m^[22m[39m
     [90m 87 |[39m   
}[33m;[39m
     [90m 88 |[39m 
})[33m;[39m
     [90m 89 |[39m 
afterAll(() [33m=>[39m 
{[0m

      at 
console.originalError [as 
error] (jest.setup.js:86:5)
      at printWarning (node_
modules/react-dom/cjs/react-
dom.development.js:86:30)
      at error (node_modules
/react-dom/cjs/react-dom.dev
elopment.js:60:7)
      at validateFunctionCom
ponentInDev (node_modules/re
act-dom/cjs/react-dom.develo
pment.js:20193:9)
      at 
mountIndeterminateComponent 
(node_modules/react-dom/cjs/
react-dom.development.js:201
60:7)
      at beginWork (node_mod
ules/react-dom/cjs/react-dom
.development.js:21587:16)
      at beginWork$1 (node_m
odules/react-dom/cjs/react-d
om.development.js:27426:14)
      at performUnitOfWork (
node_modules/react-dom/cjs/r
eact-dom.development.js:2656
0:12)
      at workLoopSync (node_
modules/react-dom/cjs/react-
dom.development.js:26466:5)
      at renderRootSync (nod
e_modules/react-dom/cjs/reac
t-dom.development.js:26434:7
)
      at 
performConcurrentWorkOnRoot 
(node_modules/react-dom/cjs/
react-dom.development.js:257
38:74)
      at flushActQueue (node
_modules/react/cjs/react.dev
elopment.js:2667:24)
      at act (node_modules/r
eact/cjs/react.development.j
s:2582:11)
      at node_modules/@testi
ng-library/react/dist/act-co
mpat.js:47:25
      at renderRoot (node_mo
dules/@testing-library/react
/dist/pure.js:190:26)
      at render (node_module
s/@testing-library/react/dis
t/pure.js:292:10)
      at renderWithProvider 
(__tests__/AppSidebar.test.j
sx:45:18)
      at 
Object.renderWithProvider (_
_tests__/AppSidebar.test.jsx
:53:5)

PASS __tests__/FeedbackPromp
t.test.js
PASS 
__tests__/Provider.test.jsx
  ● Console

    console.log
      ✅ User saved to DB

      at log 
(app/provider.jsx:39:22)

    console.log
      ✅ User saved to DB

      at log 
(app/provider.jsx:39:22)

    console.log
      ✅ User saved to DB

      at log 
(app/provider.jsx:39:22)

    console.log
      ✅ User saved to DB

      at log 
(app/provider.jsx:39:22)

PASS __tests__/RootLayout.te
st.jsx
PASS __tests__/InterviewDeta
ilContainer.test.jsx
PASS __tests__/QuestionsList
Container.test.jsx
PASS __tests__/StartIntervie
w.test.jsx (10.494 s)
  ● Console

    console.error
      Warning: Function 
components cannot be given 
refs. Attempts to access 
this ref will fail. Did you 
mean to use 
React.forwardRef()?
      
      Check the render 
method of 
`Primitive.div.SlotClone`.
          at className (E:\N
extJS\ai-recruiter2\componen
ts\ui\alert-dialog.jsx:28:3)
          at E:\NextJS\ai-re
cruiter2\node_modules\@radix
-ui\react-primitive\node_mod
ules\@radix-ui\react-slot\sr
c\slot.tsx:68:13
          at E:\NextJS\ai-re
cruiter2\node_modules\@radix
-ui\react-primitive\node_mod
ules\@radix-ui\react-slot\sr
c\slot.tsx:15:13
          at E:\NextJS\ai-re
cruiter2\node_modules\@radix
-ui\react-primitive\src\prim
itive.tsx:40:13
          at E:\NextJS\ai-re
cruiter2\node_modules\@radix
-ui\react-portal\src\portal.
tsx:22:22
          at Presence (E:\Ne
xtJS\ai-recruiter2\node_modu
les\@radix-ui\react-presence
\src\presence.tsx:12:11)
          at Provider (E:\Ne
xtJS\ai-recruiter2\node_modu
les\@radix-ui\react-context\
src\create-context.tsx:59:15
)
          at DialogPortal (E
:\NextJS\ai-recruiter2\node_
modules\@radix-ui\react-dial
og\src\dialog.tsx:146:11)
          at 
AlertDialogPortal (E:\NextJS
\ai-recruiter2\node_modules\
@radix-ui\react-alert-dialog
\src\alert-dialog.tsx:65:11)
          at props (E:\NextJ
S\ai-recruiter2\components\u
i\alert-dialog.jsx:22:6)
          at className (E:\N
extJS\ai-recruiter2\componen
ts\ui\alert-dialog.jsx:43:3)
          at Provider (E:\Ne
xtJS\ai-recruiter2\node_modu
les\@radix-ui\react-context\
src\create-context.tsx:59:15
)
          at Dialog (E:\Next
JS\ai-recruiter2\node_module
s\@radix-ui\react-dialog\src
\dialog.tsx:52:5)
          at AlertDialog (E:
\NextJS\ai-recruiter2\node_m
odules\@radix-ui\react-alert
-dialog\src\alert-dialog.tsx
:27:11)
          at props (E:\NextJ
S\ai-recruiter2\components\u
i\alert-dialog.jsx:10:6)
          at children (E:\Ne
xtJS\ai-recruiter2\app\inter
view\[interview_id]\start\_c
omponents\AlertConfirmation.
jsx:16:29)
          at div
          at div
          at StartInterview 
(E:\NextJS\ai-recruiter2\app
\interview\[interview_id]\st
art\page.jsx:20:39)

    [0m [90m 84 |[39m    
   
[36mreturn[39m[33m;[39m
     [90m 85 |[39m     }
    
[31m[1m>[22m[39m[90m 
86 |[39m     originalError(
[33m...[39margs)[33m;[39
m
     [90m    |[39m     
[31m[1m^[22m[39m
     [90m 87 |[39m   
}[33m;[39m
     [90m 88 |[39m 
})[33m;[39m
     [90m 89 |[39m 
afterAll(() [33m=>[39m 
{[0m

      at 
console.originalError [as 
error] (jest.setup.js:86:5)
      at printWarning (node_
modules/react-dom/cjs/react-
dom.development.js:86:30)
      at error (node_modules
/react-dom/cjs/react-dom.dev
elopment.js:60:7)
      at validateFunctionCom
ponentInDev (node_modules/re
act-dom/cjs/react-dom.develo
pment.js:20193:9)
      at 
mountIndeterminateComponent 
(node_modules/react-dom/cjs/
react-dom.development.js:201
60:7)
      at beginWork (node_mod
ules/react-dom/cjs/react-dom
.development.js:21587:16)
      at beginWork$1 (node_m
odules/react-dom/cjs/react-d
om.development.js:27426:14)
      at performUnitOfWork (
node_modules/react-dom/cjs/r
eact-dom.development.js:2656
0:12)
      at workLoopSync (node_
modules/react-dom/cjs/react-
dom.development.js:26466:5)
      at renderRootSync (nod
e_modules/react-dom/cjs/reac
t-dom.development.js:26434:7
)
      at 
performSyncWorkOnRoot (node_
modules/react-dom/cjs/react-
dom.development.js:26085:20)
      at flushSyncCallbacks 
(node_modules/react-dom/cjs/
react-dom.development.js:120
42:22)
      at flushActQueue (node
_modules/react/cjs/react.dev
elopment.js:2667:24)
      at act (node_modules/r
eact/cjs/react.development.j
s:2582:11)
      at node_modules/@testi
ng-library/react/dist/act-co
mpat.js:47:25
      at 
Object.eventWrapper (node_mo
dules/@testing-library/react
/dist/pure.js:107:28)
      at fireEvent (node_mod
ules/@testing-library/dom/di
st/events.js:12:35)
      at Function.fireEvent.
<computed> [as click] (node_
modules/@testing-library/dom
/dist/events.js:110:36)
      at Function.fireEvent.
<computed> [as click] (node_
modules/@testing-library/rea
ct/dist/fire-event.js:15:52)
      at Object.click (__tes
ts__/StartInterview.test.jsx
:152:15)

    console.log
      Feedback generation 
failed: Error: network
          at 
Object.<anonymous> (E:\NextJ
S\ai-recruiter2\__tests__\St
artInterview.test.jsx:129:38
)
          at 
Promise.finally.completed (E
:\NextJS\ai-recruiter2\node_
modules\jest-circus\build\je
stAdapterInit.js:1557:28)
          at new Promise 
(<anonymous>)
          at 
callAsyncCircusFn (E:\NextJS
\ai-recruiter2\node_modules\
jest-circus\build\jestAdapte
rInit.js:1497:10)
          at 
_callCircusTest (E:\NextJS\a
i-recruiter2\node_modules\je
st-circus\build\jestAdapterI
nit.js:1007:40)
          at runNextTicks (n
ode:internal/process/task_qu
eues:60:5)
          at listOnTimeout 
(node:internal/timers:545:9)
          at processTimers 
(node:internal/timers:519:7)
          at _runTest (E:\Ne
xtJS\ai-recruiter2\node_modu
les\jest-circus\build\jestAd
apterInit.js:947:3)
          at E:\NextJS\ai-re
cruiter2\node_modules\jest-c
ircus\build\jestAdapterInit.
js:849:7
          at 
_runTestsForDescribeBlock (E
:\NextJS\ai-recruiter2\node_
modules\jest-circus\build\je
stAdapterInit.js:862:11)
          at 
_runTestsForDescribeBlock (E
:\NextJS\ai-recruiter2\node_
modules\jest-circus\build\je
stAdapterInit.js:857:11)
          at run (E:\NextJS\
ai-recruiter2\node_modules\j
est-circus\build\jestAdapter
Init.js:761:3)
          at runAndTransform
ResultsToJestFormat (E:\Next
JS\ai-recruiter2\node_module
s\jest-circus\build\jestAdap
terInit.js:1918:21)
          at jestAdapter (E:
\NextJS\ai-recruiter2\node_m
odules\jest-circus\build\run
ner.js:101:19)
          at 
runTestInternal (E:\NextJS\a
i-recruiter2\node_modules\je
st-runner\build\testWorker.j
s:275:16)
          at runTest (E:\Nex
tJS\ai-recruiter2\node_modul
es\jest-runner\build\testWor
ker.js:343:7)
          at Object.worker (
E:\NextJS\ai-recruiter2\node
_modules\jest-runner\build\t
estWorker.js:497:12)

      at log (app/interview/
[interview_id]/start/page.js
x:91:13)

PASS 
__tests__/AuthPage.test.jsx
PASS __tests__/CreateIntervi
ew.credits.test.jsx
  ● Console

    console.log
      FormData updated: {}

      at log (E:\NextJS\ai-r
ecruiter2\app\(main)../../da
shboard/create-interview/pag
e.jsx:35:13)

    console.log
      FormData updated: {
        jobPosition: 'Dev',
        jobDescription: 
'Desc',
        duration: '30 Min',
        type: [ 'Video 
Interview' ]
      }

      at log (E:\NextJS\ai-r
ecruiter2\app\(main)../../da
shboard/create-interview/pag
e.jsx:35:13)

    console.log
      Form data: {
        jobPosition: 'Dev',
        jobDescription: 
'Desc',
        duration: '30 Min',
        type: [ 'Video 
Interview' ]
      }

      at Object.log [as 
GoToNext] (E:\NextJS\ai-recr
uiter2\app\(main)../../dashb
oard/create-interview/page.j
sx:39:13)

    console.log
      ✅ User saved to DB

      at log 
(app/provider.jsx:39:22)

PASS 
__tests__/HomePage.test.jsx
PASS __tests__/StartIntervie
w.feedback.test.jsx (10.66 
s)
  ● Console

    console.log
      No feedback generated 
from AI

      at log (app/interview/
[interview_id]/start/page.js
x:68:15)

    console.log
      Feedback generation 
failed: SyntaxError: 
Unexpected token '`', 
"```json invalid" is not 
valid JSON
          at JSON.parse 
(<anonymous>)
          at parse (E:\NextJ
S\ai-recruiter2\app\intervie
w\[interview_id]\start\page.
jsx:76:25)
          at stopInterview (
E:\NextJS\ai-recruiter2\app\
interview\[interview_id]\sta
rt\page.jsx:195:3)

      at log (app/interview/
[interview_id]/start/page.js
x:91:13)

PASS 
__tests__/ApiDocs.test.jsx
------------------------------------------------------------------|---------|----------|---------|---------|---------------------------
File                                                              | % Stmts | % Branch | % Funcs | % Lines | Uncovered Line #s         
------------------------------------------------------------------|---------|----------|---------|---------|---------------------------
All files                                                         |   91.69 |    71.02 |   91.83 |   92.89 |                           
 app                                                              |   94.82 |     87.5 |     100 |      98 |                           
  layout.js                                                       |   88.88 |      100 |     100 |     100 |                           
  page.js                                                         |     100 |      100 |     100 |     100 |                           
  provider.jsx                                                    |   95.65 |     87.5 |     100 |   97.43 | 41                        
 app/(main)                                                       |     100 |      100 |     100 |     100 |                           
  layout.js                                                       |     100 |      100 |     100 |     100 |                           
  provider.js                                                     |     100 |      100 |     100 |     100 |                           
 app/(main)/_components                                           |     100 |    69.23 |     100 |     100 |                           
  AppSidebar.jsx                                                  |     100 |    69.23 |     100 |     100 | 85-93                     
 app/(main)/dashboard                                             |     100 |      100 |     100 |     100 |                           
  page.jsx                                                        |     100 |      100 |     100 |     100 |                           
 app/(main)/dashboard/_components                                 |   92.53 |    56.41 |     100 |      95 |                           
  CreateOptions.jsx                                               |     100 |      100 |     100 |     100 |                           
  InterviewCard.jsx                                               |   82.14 |    44.82 |     100 |    87.5 | 47-49                     
  LatestInterviewsList.jsx                                        |     100 |     87.5 |     100 |     100 | 29                        
  WelcomeContainer.jsx                                            |     100 |      100 |     100 |     100 |                           
 app/(main)/dashboard/create-interview                            |   82.75 |    66.66 |     100 |   82.14 |                           
  page.jsx                                                        |   82.75 |    66.66 |     100 |   82.14 | 42-43,76-84,92-96         
 app/(main)/dashboard/create-interview/_components                |   94.66 |    81.25 |     100 |   94.28 |                           
  FormContainer.jsx                                               |     100 |    83.33 |     100 |     100 | 104                       
  InterviewLink.jsx                                               |     100 |       50 |     100 |     100 | 68                        
  QuestionList.jsx                                                |   89.18 |    81.81 |     100 |   88.88 | 30-31,35-36               
  QuestionsListContainer.jsx                                      |     100 |      100 |     100 |     100 |                           
 app/(main)/schedule-interview/[interview_id]/details             |   86.36 |     62.5 |     100 |      90 |                           
  page.jsx                                                        |   86.36 |     62.5 |     100 |      90 | 30-31                     
 app/(main)/schedule-interview/[interview_id]/details/_components |      92 |       68 |   71.42 |   90.47 |                           
  CandidateFeedbackDialog.jsx                                     |     100 |    72.22 |     100 |     100 | 50-99                     
  CandidateList.jsx                                               |   85.71 |      100 |      50 |   83.33 | 14                        
  interviewDetailContainer.jsx                                    |      90 |    57.14 |   66.66 |    87.5 | 13                        
 app/api-docs                                                     |   83.33 |      100 |   33.33 |   83.33 |                           
  page.jsx                                                        |   83.33 |      100 |   33.33 |   83.33 | 10                        
 app/api/ai-model                                                 |   89.79 |    73.07 |     100 |   93.33 |                           
  route.jsx                                                       |   89.79 |    73.07 |     100 |   93.33 | 32,38-39                  
 app/auth                                                         |     100 |      100 |     100 |     100 |                           
  page.jsx                                                        |     100 |      100 |     100 |     100 |                           
 app/interview/[interview_id]                                     |      95 |    85.71 |   83.33 |   97.36 |                           
  page.jsx                                                        |      95 |    85.71 |   83.33 |   97.36 | 105                       
 app/interview/[interview_id]/start                               |   89.28 |       75 |   91.66 |   90.12 |                           
  page.jsx                                                        |   89.28 |       75 |   91.66 |   90.12 | 77-89,163-164,177-178,192 
 app/interview/[interview_id]/start/_components                   |   91.66 |      100 |   77.77 |      95 |                           
  AlertConfirmation.jsx                                           |     100 |      100 |     100 |     100 |                           
  TimerComponent.jsx                                              |   89.47 |      100 |   71.42 |   93.75 | 14                        
 context                                                          |     100 |      100 |     100 |     100 |                           
  interviewDataContext.jsx                                        |     100 |      100 |     100 |     100 |                           
------------------------------------------------------------------|---------|----------|---------|---------|---------------------------

Summary of all failing tests
FAIL __tests__/CandidateFeed
backDialog.test.jsx (7.548 
s)
  ● 
CandidateFeedbackDialog 
Component › renders 
feedback details correctly

    
TestingLibraryElementError: 
Found multiple elements 
with the text: 8/10

    Here are the matching 
elements:

    Ignored nodes: 
comments, script, style
    [36m<h2[39m
      [33mclass[39m=[32m"
text-primary text-2xl 
font-bold"[39m
    [36m>[39m
      [0m8[0m
      [0m/10[0m
    [36m</h2>[39m

    Ignored nodes: 
comments, script, style
    [36m<span>[39m
      [0m8[0m
      [0m/10[0m
    [36m</span>[39m

    Ignored nodes: 
comments, script, style
    [36m<span>[39m
      [0m8[0m
      [0m/10[0m
    [36m</span>[39m

    (If this is 
intentional, then use the 
`*AllBy*` variant of the 
query (like 
`queryAllByText`, 
`getAllByText`, or 
`findAllByText`)).

    Ignored nodes: 
comments, script, style
    [36m<body>[39m
      [36m<div>[39m
        [36m<div[39m
          [33mdata-testid[
39m=[32m"dialog"[39m
        [36m>[39m
          [36m<div[39m
            [33mdata-testid
[39m=[32m"dialog-trigger"
[39m
          [36m>[39m
            
[36m<button[39m
              [33mclass[39
m=[32m"inline-flex 
items-center justify-center 
cursor-pointer gap-2 
whitespace-nowrap 
rounded-md text-sm 
font-medium transition-all d
isabled:pointer-events-none 
disabled:opacity-50 
[&_svg]:pointer-events-none 
[&_svg:not([class*='size-'])
]:size-4 shrink-0 
[&_svg]:shrink-0 
outline-none 
focus-visible:border-ring 
focus-visible:ring-ring/50 
focus-visible:ring-[3px] ari
a-invalid:ring-destructive/2
0 dark:aria-invalid:ring-des
tructive/40 aria-invalid:bor
der-destructive border 
bg-background shadow-xs 
hover:bg-accent hover:text-a
ccent-foreground 
dark:bg-input/30 
dark:border-input 
dark:hover:bg-input/50 h-9 
px-4 py-2 has-[>svg]:px-3 
text-primary"[39m
              [33mdata-slot
[39m=[32m"button"[39m
            [36m>[39m
              [0mView 
Report[0m
            
[36m</button>[39m
          [36m</div>[39m
          [36m<div[39m
            [33mdata-testid
[39m=[32m"dialog-content"
[39m
          [36m>[39m
            [36m<div[39m
              [33mdata-test
id[39m=[32m"dialog-header"
[39m
            [36m>[39m
              [36m<div[39m
                [33mdata-te
stid[39m=[32m"dialog-title
"[39m
              [36m>[39m
                
[0mFeedback[0m
              
[36m</div>[39m
              [36m<div[39m
                [33mdata-te
stid[39m=[32m"dialog-descr
iption"[39m
              [36m>[39m
                
[36m<div[39m
                  [33mclass
[39m=[32m"mt-5"[39m
                [36m>[39m
                  
[36m<div[39m
                    
[33mclass[39m=[32m"flex 
justify-between 
items-center"[39m
                  
[36m>[39m
                    
[36m<div[39m
                      
[33mclass[39m=[32m"flex 
items-center gap-5"[39m
                    
[36m>[39m
                      
[36m<h2[39m
                        [33
mclass[39m=[32m"bg-primary
 p-3 px-4.5 font-bold 
text-white 
rounded-full"[39m
                      
[36m>[39m
                        
[0mJ[0m
                      
[36m</h2>[39m
                      
[36m<div>[39m
                        
[36m<h2[39m
                          [
33mclass[39m=[32m"font-bol
d"[39m
                        
[36m>[39m
                          
[0mJohn Doe[0m
                        
[36m</h2>[39m
                        
[36m<h2[39m
                          [
33mclass[39m=[32m"text-sm 
text-gray-500"[39m
                        
[36m>[39m
                          
[0mjohn@example.com[0m
                        
[36m</h2>[39m
                      
[36m</div>[39m
                    
[36m</div>[39m
                    
[36m<div[39m
                      
[33mclass[39m=[32m"flex 
gap-3 items-center"[39m
                    
[36m>[39m
                      
[36m<h2[39m
                        [33
mclass[39m=[32m"text-prima
ry text-2xl font-bold"[39m
                      
[36m>[39m
                        
[0m8[0m
                        
[0m/10[0m
                      
[36m</h2>[39m
                    
[36m</div>[39m
                  
[36m</div>[39m
                  
[36m<div[39m
                    [33mcla
ss[39m=[32m"mt-5"[39m
                  
[36m>[39m
                    
[36m<h2[39m
                      [33mc
lass[39m=[32m"font-bold"[
39m
                    
[36m>[39m
                      
[0mSkill Assessment[0m
                    
[36m</h2>[39m
                    
[36m<div[39m
                      
[33mclass[39m=[32m"mt-5 
space-y-4"[39m
                    
[36m>[39m
                      
[36m<div>[39m
                        
[36m<h2[39m
                          
[33mclass[39m=[32m"flex 
justify-between"[39m
                        
[36m>[39m
                          
[0mTechnical Skills[0m
                          
[36m<span>[39m
                            
[0m9[0m
                            
[0m/10[0m
                          
[36m</span>[39m
                        
[36m</h2>[39m
                        
[36m<div[39m
                          [
33mdata-testid[39m=[32m"pr
ogress-bar"[39m
                          [
33mdata-value[39m=[32m"90"
[39m
                        
[36m/>[39m
                      
[36m</div>[39m
                      
[36m<div>[39m
                        
[36m<h2[39m
                          
[33mclass[39m=[32m"flex 
justify-between"[39m
                        
[36m>[39m
                          
[0mCommunication[0m
                          
[36m<span>[39m
                            
[0m7[0m
                            
[0m/10[0m
                          
[36m</span>[39m
                        
[36m</h2>[39m
                        
[36m<div[39m
                          [
33mdata-testid[39m=[32m"pr
ogress-bar"[39m
                          [
33mdata-value[39m=[32m"70"
[39m
                        
[36m/>[39m
                      
[36m</div>[39m
                      
[36m<div>[39m
                        
[36m<h2[39m
                          
[33mclass[39m=[32m"flex 
justify-between"[39m
                        
[36m>[39m
                          
[0mProblem Solving[0m
                          
[36m<span>[39m
                            
[0m8[0m
                            
[0m/10[0m
                          
[36m</span>[39m
                        
[36m</h2>[39m
                        
[36m<div[39m
                          [
33mdata-testid[39m=[32m"pr
ogress-bar"[39m
                          [
33mdata-value[39m=[32m"80"
[39m
                        
[36m/>[39m
                      
[36m</div>[39m
                      
[36m<div>[39m
                        
[36m<h2[39m
                          
[33mclass[39m=[32m"flex 
justify-between"[39m
                        
[36m>[39m
                          
[0mExperience[0m
                          
[36m<span>[39m
                            
[0m8[0m
                            
[0m/10[0m
                          
[36m</span>[39m
                        
[36m</h2>[39m
                        
[36m<div[39m
                          [
33mdata-testid[39m=[32m"pr
ogress-bar"[39m
                          [
33mdata-value[39m=[32m"80"
[39m
                        
[36m/>[39m
                      
[36m</div>[39m
                    
[36m</div>[39m
                  
[36m</div>[39m
                  
[36m<div[39m
                    [33mcla
ss[39m=[32m"mt-5"[39m
                  
[36m>[39m
                    
[36m<h2[39m
                      [33mc
lass[39m=[32m"font-bold"[
39m
                    
[36m>[39m
                      
[0mPerformance Summary[0m
                    
[36m</h2>[39m
                    
[36m<div[39m
                      
[33mclass[39m=[32m"p-5 
bg-secondary my-3 
rounded-md space-y-2"[39m
                    
[36m>[39m
                      
[36m<p>[39m
                        
[0mStrong candidate[0m
                      
[36m</p>[39m
                      
[36m<p>[39m
                        
[0mGood communication[0m
                      
[36m</p>[39m
                    
[36m</div>[39m
                  
[36m</div>[39m
                  
[36m<div[39m
                    
[33mclass[39m=[32m"p-5 
mt-10 flex items-center 
justify-between rounded-md 
bg-green-100"[39m
                  
[36m>[39m
                    
[36m<div>[39m
                      
[36m<h2[39m
                        [33
mclass[39m=[32m"font-bold 
text-green-700"[39m
                      
[36m>[39m
                        
[0mRecommendation[0m
                      
[36m</h2>[39m
                      
[36m<p[39m
                        
[33mclass[39m=[32m"mt-1 
text-green-500"[39m
                      
[36m>[39m
                        
[0mHighly recommended for 
the role.[0m
                      
[36m</p>[39m
                    
[36m</div>[39m
                    
[36m<button[39m
                      [33mc
lass[39m=[32m"inline-flex 
items-center justify-center 
cursor-pointer gap-2 
whitespace-nowrap 
rounded-md text-sm 
font-medium transition-all d
isabled:pointer-events-none 
disabled:opacity-50 
[&_svg]:pointer-events-none 
[&_svg:not([class*='size-'])
]:size-4 shrink-0 
[&_svg]:shrink-0 
outline-none 
focus-visible:border-ring 
focus-visible:ring-ring/50 
focus-visible:ring-[3px] ari
a-invalid:ring-destructive/2
0 dark:aria-invalid:ring-des
tructive/40 aria-invalid:bor
der-destructive 
text-primary-foreground 
hover:bg-primary/90 h-9 
px-4 py-2 has-[>svg]:px-3 
bg-green-700"[39m
                      [33md
ata-slot[39m=[32m"button"
[39m
                    
[36m>[39m
                      
[0mSend Msg[0m
                    
[36m</button>[39m
                  
[36m</div>[39m
                
[36m</div>[39m
              
[36m</div>[39m
            [36m</div>[39m
          [36m</div>[39m
        [36m</div>[39m
      [36m</div>[39m
    [36m</body>[39m

    [0m [90m 53 |[39m    
 expect(screen[33m.[39mget
ByText([32m"John Doe"[39m)
)[33m.[39mtoBeInTheDocumen
t()[33m;[39m
     [90m 54 |[39m     exp
ect(screen[33m.[39mgetByTe
xt([32m"john@example.com"[
39m))[33m.[39mtoBeInTheDoc
ument()[33m;[39m
    
[31m[1m>[22m[39m[90m 
55 |[39m     expect(screen
[33m.[39mgetByText([32m"8/
10"[39m))[33m.[39mtoBeInT
heDocument()[33m;[39m
     [90m    |[39m        
           
[31m[1m^[22m[39m
     [90m 56 |[39m     exp
ect(screen[33m.[39mgetByTe
xt([32m"Technical Skills"[
39m))[33m.[39mtoBeInTheDoc
ument()[33m;[39m
     [90m 57 |[39m     exp
ect(screen[33m.[39mgetByTe
xt([32m"9/10"[39m))[33m.
[39mtoBeInTheDocument()[33m
;[39m
     [90m 58 |[39m     exp
ect(screen[33m.[39mgetByTe
xt([32m"Strong candidate"[
39m))[33m.[39mtoBeInTheDoc
ument()[33m;[39m[0m

      at 
Object.getElementError (node
_modules/@testing-library/do
m/dist/config.js:37:19)
      at getElementError (no
de_modules/@testing-library/
dom/dist/query-helpers.js:20
:35)
      at getMultipleElements
FoundError (node_modules/@te
sting-library/dom/dist/query
-helpers.js:23:10)
      at node_modules/@testi
ng-library/dom/dist/query-he
lpers.js:55:13
      at node_modules/@testi
ng-library/dom/dist/query-he
lpers.js:95:19
      at Object.getByText (_
_tests__/CandidateFeedbackDi
alog.test.jsx:55:19)


Test Suites: 1 failed, 27 
passed, 28 total
Tests:       1 failed, 86 
passed, 87 total
Snapshots:   0 total
Time:        17.702 s
Ran all test suites.
